{
  "schema_version": "v2.1.1",
  "run_id": "123e4567-e89b-72d3-a456-426614174000",
  "created_at": "2026-03-05T12:44:01.388220+00:00",
  "sources": [
    {
      "source_id": "SRC01",
      "filename": "example-thread.pdf",
      "sha256": "aaaaaaaaaaaaaaaaaaaaaaaaaaaaaaaaaaaaaaaaaaaaaaaaaaaaaaaaaaaaaaaa",
      "bytes": 123456,
      "page_count": 10,
      "vault_uri": "vault://cep/2026/123e4567/sources/example-thread.pdf",
      "drive_uri": "drive://CEP/Runs/2026/123e4567/example-thread.pdf",
      "ingested_at": "2026-03-05T12:44:01.388247+00:00",
      "notes": "Fixture source for CI validation"
    }
  ]
}
